GPA,Gender,breakfast,coffee,comfort_food,comfort_food_reasons,comfort_food_reasons_coded,comfort_food_reasons_coded,diet_current,drink,eating_changes,eating_changes_coded,eating_changes_coded1,eating_out,father_profession,fav_cuisine,food_childhood,healthy_meal,ideal_diet,income,meals_dinner_friend,mother_profession,self_perception_weight,sports,type_sports,vitamins,weight
Unknown,1,1,2,"Chips, chocolate, ,mozzarella sticks ","Boredom, sadness, anxiety",2,2,"High in carbs, but I have recently tried to cut down on fats, salt, and sugars. I choose more organic options as well as more fruits and vegetables. ",2,I've definitely gotten used to eating more often since I have a fully cooked meal available to me at all the time.  Sometimes I would only eat one full meal and a snack in high school because I was so busy and did not have the time to cook. ,1,2,2,Business Owner,Italian ,"Chicken Marsala, Manicotti, Mashed Potatoes","Vegetables, white meat, and a starch like potatoes, water, and fruit for dessert ","A low car, low fat diet with no red meat and lots of plant-based things. I would like to cut red meat out entirely and also cut down on processed snack foods. ",5,"Pasta, Burgers and Fries, Chicken Marsala",Substitute Secretary,5,2,None at the moment,1,230
3,1,1,2,"ice cream, chips, candy","Boredom, laziness, anger",2,2,"Since I am a college student I rarely cook full meals with protein, vegetables and starch. I usually just heat up leftovers from a restaurant or go eat casual food at the dining hall.",2,I do not eat full meals. Rarely eat 3 meals a day. ,1,10,3,Ford Plant employee,Italian,"hot dogs, chicken fingers, mashed potatoes","I think a healthy meals includes some kind of protein, preferably meat, vegetables, and a starch such as potatoes or rice","My ideal diet right now would be how it was when I lived at home. I ate breakfast every morning, brought a lunch to school, and had a home cooked meal by my mom that included meat, vegetables and a starch. ",4,"Chicken rice and asparagus, pizza, something easy in the crockpot",Insurance Coordinator,3,1,volleyball,2,125
3,1,1,2,"Pizza, soda, chocolate brownie, chicken tikka masala and butter naan ",Stress and sadness,,1,"It is pretty balanced with a diverse mixture of proteins, carbohydrates, vitamins and minerals. Fruits and chicken dominate my diet. ",1,"I have been drinking more water. Since college, I've been more conscious about my diet and incorporated more fruits on my diet. ",2,12,5,Clinical Researcher,Nepali,"Chicken Biryani, Dad's burgers, Chicken curry",A healthy meal constitutes of balanced diet with fruits and veggies dominating the plate. ,My ideal diet would getting to eat small portioned meals in every 2-3 hours. ,1,"Marinated nuts, prawn crackers, drink of their choice, mixed veggie crackersRice, chicken curry, lentil, pickle, potato kebabLemon Meringue Pie",Supervisor,4,2,None,2,130
3.8,1,1,1,"Chocolate, Pasta, Cookies","I am always stressed out, and bored when I am in my apartment. ",,1,I try to eat a balanced meal. I refrain from anything too fatty. ,1,My diet could improve now. I have been eating more than I should.,1,2,2,Retired ,I really love italian food and thai food,dino chicken nuggets,To me a healthy meal is balanced and ,I would like to try to eat vegan. ,4,"Pasta, Croque Madam, chicken ",Travel Agent,4,2,I used to play softball ,2,165
3.8,1,1,2,"Candy, salty snacks, toast","Stress, sadness, boredom",,1,moderately health conscious ,2,Late night snacking,1,2,2,Sales,Italian,Spaghetti and chicken parm,"equal portions of carbs, proteins and fruits/veges","Small portions, healthy foods",6,"Steak, salmon, chicken parm",Real Estate,3,1,Ice hockey,2,128
3.4,1,1,2,"Mac in cheese, pizza, mozzarella sticks ","Stress, frustration, self-consciousness ",,1,"protein, carbs, less fruits and vegetables, some sweets ",2,I snack less and eat smaller portions ,2,5,3,School Library Media Specialist ,Italian ,Chicken parm. ,Salad with chicken and vegetables with a raspberry vinaigrette ,Much more vegetables and lean protein,6,"Spaghetti, Grilled Chicken, Pizza ",School Library Media Specialist ,5,2, None,1,200
3.7,1,1,1,"Ice-cream, pizza, chocolate",Sadness and cravings,,3,I eat at least 2 times a day at the universities dining places. I also sometimes cook myself and try to eat healthy a majority of the time. ,1,I eat out more. ,1,3,4,Retired,Italian,Spaghetti,"It includes a protein, vegetable, fruit, and grain. ",I hope to continue to eat healthy and cook more on my own. I want to incorporate more fruits and vegetables. ,3,"Grilled chicken, Spaghetti, Alfredo ",Deceased,3,1,Volleyball,2,160
2.9,2,1,2,"snacks, chips, ",boredom,,2,some healthy food and also some not so healthy.,2,more healthy food,2,5,2,nan,nan,"Pizza, Pita, Lasagna",low calories plenty of veggies,more healthy food such as vegetables than bad food such as burgers.,5,nan,nan,3,2,nan,2,170
3.9,1,1,2,"Chocolate, Ice cream, pizza","Sadness, happiness and boredom",,3,I eat a lot of proteins and fruit and vegetables. I try to stay away from carbohydrates and sugary foods.,1,I had to change a lot. I keep track of calories and cut out most breads and wraps.,2,5,4,Mechanical Engineer ,Italian ,"Mac & Cheese, Chicken, Stir Fry ",A pice of meat such as chicken with a side of vegetables and possibly a salad,I wouldn't want or crave any sweets or breads.I would be satisfied with protein and fruit and veggies. ,6,"Dinner, Lunch, Dessert ",Fourth Grade Teacher ,3,2,nan,2,129
3.6,1,1,1,"ice cream, pizza, Chinese food ",Boredom and sadness,,2,"My current diet would be considered a ""college diet"". I eat a lot of pizza and ramen noodles. ",2,They have gotten very bad. I eat a lot more food that I know I should not eat. ,1,2,3,Teacher,Italian ,Mac and Cheese ,"Blackened Chicken, broccoli, and milk",My ideal diet would be a healthy diet. I would eat meats and veggies. ,6,"Beef Stroganoff, Chicken and Mashed Potatoes, Tacos ",Accountant ,4,2,None,2,170
2.8,2,1,2,"Burgers, indian and korean food","sadness, happiness and hunger",,3,Not very healthy,2,not eating meals on time,1,10,3,Politician,Korean,"Dumplings, Chicken Curry and Pizza","Meat, greens and food containing protein",Healthy and tasty,3,"Meat, meat and meat","Works in WWF, world wild life fund",1,1,"Tennis, Basketball",2,138
3.3,2,1,2,"chocolate bar, ice cream, pretzels, potato chips and protein bars.","Stress, boredom and physical activity",,1,I currently eat an abundance of carbohydrates. I have a low intake of protein. I overly intake calcium.,2,Eating more dairy due to more ice cream intake.,1,3,2,Pharmaceutical,I do not like cuisine,"Pasta, Pizza, Popcorn",Intaking the proper amount of each food group,"My ideal diet would be an equal balance of all the food groups. I would like to eat more protein. Also, i would prefer to cut back on the junk food.",6,"Pasta, Chicken, Pizza",Health teacher,2,1,Hockey,2,150
3.4,1,1,2,"Ice cream, chocolate, pizza, cucumber ","loneliness, homework, boredom ",,2,"It is very unbalance. Mostly fat food, Lack of vegetables.",1,less vegetable more sweats,1,3,4,Business Man,Chinese ,"Fry Chicken, Rice Vegetable",BBQ Chicken with mash sweat potatoes and steam vegetable with corn and a glass of water.,Very healthy. Freshly done. properly cooked,1,"Rice and Peas and Chicken, Jerk Chicken and Shrimp",Business Woman,4,2,none,1,170
3.77,1,1,2,"Noodle ( any kinds of noodle), Tuna sandwich, and Egg.",When i'm  eating with my close friends/ Food smell or look good/ when I feel tired,,5,I eat in dining hall of school everyday. I usually have both meat and a little vegetable in every meal. ,1,"I eat more vegetable. Since coming to college, I started to eat salads and tried to eat salads at least three times a week.",2,5,2,His own business,Vietnamese cuisine,"Noodle, Wings, and Tiramisu",Including both vegetable and meat,My ideal diet should include both vegetable and meat. It is not only healthy but also delicious. ,2,"Vietnamese fried rolls, Pho, Some kinds of noodles.",Her own business,4,2,"No, I don't play sport.",1,113
3.63,1,1,1,"Chinese, chips, cake",Stress and boredom ,,1,Try to eat as healthy as possible. A few days where fast food comes into play because of classes. ,1,I try to eat more fruits and vegetables ,2,5,2,HVAC technician ,American ,Chinese,Chicken vegetables and fruit for dinner ,All home cooked. Healthy. Vegetables and fruit. ,3,Chinese tacos or pasta ,Grieveance coordinator of the SCI albion prison ,4,2,None,2,140
3.2,2,1,2,"chips, rice, chicken curry,","Happiness, boredom, social event",,7,"My diet is mostly whatever I get to eat in the grotto commons. Sometimes, I eat outside",1,Started eating a lot of protein rich food that i didnt before.,2,5,2,United Nations,Indian,"pizza, burger, pasta",A diet that is well balanced in most of the nutrients needed for the body.,Healthy balanced diet that tastes well.,2,"Chicken, Rice, Vegetables",Banker,4,1,Soccer,2,185
3.5,1,1,2,"wine. mac and cheese, pizza, ice cream ",boredom and sadness ,,2,"My diet consists mainly of coffee, water, fruits, vegetables, and chicken. I tend to stay away from bread and pasta as much as possible. ",2,"I have noticed there is less time for a prepared meal, so quick and easy has become the norm.",1,3,2,Accountant ,Italian ,Stromboli Mac and Cheese and Pizza,mainly protein and vegetables with a complex carb ,"My ideal diet would consist of a majority of what I consume now. I like to think I make pretty healthy choices currently, so it would most likely remain the same.",4,"pasta, fish, steak",Radiological Technician ,4,1,Softball,1,156
3,1,1,2,Pizza / Wings / Cheesecake,Loneliness / Homesick / Sadness,,3,A college student with an imbalanced diet trying to be healthy.,1,Eating Pizza as an excuse when there is nothing else to it.,1,3,4,Doctor,Mexican Food,"Isombe , Plantains and Ugali","A healthy meal is a variety of food , organic food that gives you the nutrients such as protein , carbohydrates , fat , water , vitamins and minerals.",Eating home cooked meals everyday and being able to not eat processed foods at all.,2,"Fried Rice Baked potatoes Curry Chicken",Public Health Advisor ,4,nan,basketball ,2,180
3.882,1,1,1,"rice, potato, seaweed soup",sadness,,3,"Rice, oatmeal, and tea",1,less rice,1,3,3,CEO of company,Korean,Rice and potato,lots of vegetables,lots of veggies,2,"meat, rice, kimchi",Real Estate manageer,4,2,none,2,120
3,2,1,1,"Mac n Cheese, Lasagna, Pizza","happiness, they are some of my favorite foods",,7,"I try to eat as healthy as possible everyday.  I have fruit, yogurt and a protein shake everyday.  The other foods i eat vary on a day to day basis.",2,I don't eat as much on a daily basis since coming to college.,1,8,5,Store manager at Giant Eagle,Italian,pizza and spaghetti ,"A protein, a fruit, a starch, and a salad or some sort of vegetable.",My ideal diet is the diet i am currently on.  The only thing i would change is a little bit less snack/junk food.,4,"Pizza, Spaghetti, Baked Ziti",Receptionist for a medical supply company,2,2,nan,1,135
3.9,1,1,2,"Chocolates, pizza, and Ritz.","hormones, Premenstrual syndrome.",,5,high in protein and low in carbohydrates.,1,I have learned to eat more vegetables. ,2,5,1,Journalist,HISPANIC CUISINE.,"rice, beans, and chicken / pizza/ tenders","a cup of rice, vegetables, and meat. ","Being able to balance between sweets, vegetables, fruits, carbohydrates, and fat.",5,"Vegetables, Meat, and rice.",House-wife,3,2,nan,2,135
